{
  "schemaVersion": "1",
  "generatedAtUtc": "2026-04-03T00:00:00Z",
  "channel": "stable",
  "plugins": [
    {
      "pluginId": "community.example_plugin",
      "displayName": "Example Plugin",
      "version": "0.0.014",
      "author": "MrIvoe",
      "description": "Example plugin for Spaces",
      "minHostVersion": "0.0.013",
      "maxHostVersion": "0.1.999",
      "minHostApiVersion": "0.0.012",
      "maxHostApiVersion": "0.1.999",
      "packageUrl": "https://example.invalid/community.example_plugin/0.0.014/community.example_plugin-0.0.014.sfplugin",
      "sha256": "REPLACE_WITH_REAL_SHA256",
      "packageSizeBytes": 123456,
      "updateChannelId": "stable",
      "signature": {
        "algorithm": "ecdsa-p256-sha256",
        "signatureBase64": "REPLACE_WITH_REAL_SIGNATURE",
        "signingCertChainPem": [
          "-----BEGIN CERTIFICATE-----...-----END CERTIFICATE-----"
        ],
        "leafThumbprintSha256": "REPLACE_WITH_REAL_LEAF_THUMBPRINT_SHA256"
      },
      "releaseNotesUrl": "https://example.invalid/community.example_plugin/releases/0.0.014"
    }
  ]
}

